{
  "_comment": "Export of the CMS sites and island records. Island outline and site positions from OpenStreetMap (© OpenStreetMap contributors, ODbL) via pipeline/tools/build_island.py. placeholder_uv is the old stylised position, used only when there is no outline.",
  "exported_at": null,
  "island": {
    "version": "osm-2026-10-09",
    "outline": {
      "type": "Polygon",
      "coordinates": [
        [
          [
            -69.16055,
            12.38197
          ],
          [
            -69.15992,
            12.3766
          ],
          [
            -69.15589,
            12.37155
          ],
          [
            -69.15469,
            12.36719
          ],
          [
            -69.15632,
            12.36354
          ],
          [
            -69.15576,
            12.3594
          ],
          [
            -69.15301,
            12.35477
          ],
          [
            -69.15243,
            12.35118
          ],
          [
            -69.15402,
            12.34863
          ],
          [
            -69.15424,
            12.34591
          ],
          [
            -69.15309,
            12.34302
          ],
          [
            -69.153,
            12.34029
          ],
          [
            -69.15396,
            12.33771
          ],
          [
            -69.15342,
            12.33461
          ],
          [
            -69.15137,
            12.331
          ],
          [
            -69.15059,
            12.32565
          ],
          [
            -69.15109,
            12.31854
          ],
          [
            -69.15051,
            12.31311
          ],
          [
            -69.14885,
            12.30934
          ],
          [
            -69.14732,
            12.30739
          ],
          [
            -69.1459,
            12.30727
          ],
          [
            -69.15316,
            12.29963
          ],
          [
            -69.15572,
            12.29603
          ],
          [
            -69.15399,
            12.29021
          ],
          [
            -69.15113,
            12.28498
          ],
          [
            -69.14845,
            12.28189
          ],
          [
            -69.14595,
            12.28094
          ],
          [
            -69.14247,
            12.27742
          ],
          [
            -69.138,
            12.27133
          ],
          [
            -69.13406,
            12.26832
          ],
          [
            -69.13066,
            12.26839
          ],
          [
            -69.12825,
            12.2694
          ],
          [
            -69.12684,
            12.27136
          ],
          [
            -69.12675,
            12.27339
          ],
          [
            -69.12799,
            12.27549
          ],
          [
            -69.12808,
            12.27782
          ],
          [
            -69.12703,
            12.28039
          ],
          [
            -69.12616,
            12.28038
          ],
          [
            -69.12545,
            12.27781
          ],
          [
            -69.12442,
            12.27742
          ],
          [
            -69.12304,
            12.27923
          ],
          [
            -69.12134,
            12.27962
          ],
          [
            -69.1193,
            12.27861
          ],
          [
            -69.11975,
            12.27729
          ],
          [
            -69.12267,
            12.27568
          ],
          [
            -69.12414,
            12.27397
          ],
          [
            -69.12416,
            12.27215
          ],
          [
            -69.12532,
            12.27043
          ],
          [
            -69.1276,
            12.2688
          ],
          [
            -69.12748,
            12.26622
          ],
          [
            -69.12496,
            12.26271
          ],
          [
            -69.12019,
            12.25826
          ],
          [
            -69.10902,
            12.24995
          ],
          [
            -69.10774,
            12.24946
          ],
          [
            -69.10785,
            12.25173
          ],
          [
            -69.10714,
            12.25339
          ],
          [
            -69.10521,
            12.25503
          ],
          [
            -69.10389,
            12.25553
          ],
          [
            -69.10317,
            12.25489
          ],
          [
            -69.10671,
            12.24947
          ],
          [
            -69.10708,
            12.24678
          ],
          [
            -69.10523,
            12.24479
          ],
          [
            -69.10439,
            12.24184
          ],
          [
            -69.10455,
            12.23791
          ],
          [
            -69.10251,
            12.23545
          ],
          [
            -69.09827,
            12.23444
          ],
          [
            -69.09499,
            12.23219
          ],
          [
            -69.09266,
            12.22869
          ],
          [
            -69.09176,
            12.22573
          ],
          [
            -69.09229,
            12.22331
          ],
          [
            -69.09084,
            12.22121
          ],
          [
            -69.08743,
            12.21943
          ],
          [
            -69.08584,
            12.21525
          ],
          [
            -69.08606,
            12.20867
          ],
          [
            -69.08398,
            12.20269
          ],
          [
            -69.0796,
            12.19732
          ],
          [
            -69.07299,
            12.19277
          ],
          [
            -69.06417,
            12.18904
          ],
          [
            -69.05877,
            12.1877
          ],
          [
            -69.05678,
            12.18875
          ],
          [
            -69.05158,
            12.19691
          ],
          [
            -69.04864,
            12.19987
          ],
          [
            -69.04556,
            12.20068
          ],
          [
            -69.03973,
            12.19953
          ],
          [
            -69.03115,
            12.19641
          ],
          [
            -69.02498,
            12.19298
          ],
          [
            -69.02123,
            12.18925
          ],
          [
            -69.01948,
            12.18546
          ],
          [
            -69.01974,
            12.18162
          ],
          [
            -69.01812,
            12.17681
          ],
          [
            -69.01462,
            12.17102
          ],
          [
            -69.01081,
            12.1663
          ],
          [
            -69.00671,
            12.16265
          ],
          [
            -69.00266,
            12.15526
          ],
          [
            -68.99867,
            12.14414
          ],
          [
            -68.99376,
            12.13755
          ],
          [
            -68.98792,
            12.13548
          ],
          [
            -68.98471,
            12.13351
          ],
          [
            -68.98412,
            12.13161
          ],
          [
            -68.98047,
            12.12873
          ],
          [
            -68.97374,
            12.12487
          ],
          [
            -68.97093,
            12.12672
          ],
          [
            -68.97204,
            12.13427
          ],
          [
            -68.97181,
            12.1385
          ],
          [
            -68.97024,
            12.13941
          ],
          [
            -68.96888,
            12.13873
          ],
          [
            -68.96774,
            12.13647
          ],
          [
            -68.96628,
            12.13516
          ],
          [
            -68.96451,
            12.13481
          ],
          [
            -68.96496,
            12.13309
          ],
          [
            -68.96765,
            12.13001
          ],
          [
            -68.96919,
            12.12636
          ],
          [
            -68.96959,
            12.12214
          ],
          [
            -68.96532,
            12.11728
          ],
          [
            -68.95207,
            12.10893
          ],
          [
            -68.95364,
            12.10897
          ],
          [
            -68.94532,
            12.10571
          ],
          [
            -68.9415,
            12.10429
          ],
          [
            -68.93814,
            12.10501
          ],
          [
            -68.93584,
            12.10767
          ],
          [
            -68.93329,
            12.11245
          ],
          [
            -68.93325,
            12.11507
          ],
          [
            -68.93572,
            12.11551
          ],
          [
            -68.93684,
            12.11619
          ],
          [
            -68.93661,
            12.1171
          ],
          [
            -68.94102,
            12.11697
          ],
          [
            -68.93985,
            12.1186
          ],
          [
            -68.94063,
            12.11918
          ],
          [
            -68.9381,
            12.11986
          ],
          [
            -68.94126,
            12.1208
          ],
          [
            -68.94295,
            12.12229
          ],
          [
            -68.94359,
            12.12474
          ],
          [
            -68.94285,
            12.12646
          ],
          [
            -68.93977,
            12.12744
          ],
          [
            -68.93996,
            12.12636
          ],
          [
            -68.9419,
            12.12564
          ],
          [
            -68.94081,
            12.12431
          ],
          [
            -68.93913,
            12.1248
          ],
          [
            -68.93692,
            12.12662
          ],
          [